title, description
The All Encompassing SXSW Interactive 2018 Recap,Blockchain Blockchain Blockchain Blockchain Blockchain Blockchain Blockchain Blockchain Blockchain Blockchain Blockchain Blockchain…,https://hackernoon.com/the-all-encompassing-sxsw-interactive-2018-recap-c35318bdf14f
blockchain,Over the counter trading infused with the Crypto Blockchain technology leaves you with CryptoCashChain.We are excited to announce our simple and efficient way for you to trade your Crypto in a safe environment helping you cash out profits.You will be able to …,https://slashdot.org/submission/8004391/blockchain
Blockchain,Hello;Here is the Blockchain illustration i did for Ben Inc.Give it a ❤️ And Follow me on:Instagram | Behance | Twitter,https://dribbble.com/shots/4341670-Blockchain
Blockchain,View on Dribbble,https://dribbble.com/shots/4362169-Blockchain
Blockchain,Get the most out of cutting-edge blockchain technology using the hands-on information contained in this comprehensive resource. Written by a team of technology and legal experts; Blockchain: A Practical Guide to Developing Business; Law; and Technology Soluti…,http://it-ebooks.info/book/1522278515-blockchain/
Blockchain,Editorial illustration (ink over Moleskine watercolor album A3),https://dribbble.com/shots/4673338-Blockchain
Blockchain,Blockchain technology is revolutionizing the way in which information is stored and shared. It facilitates the creation of a distributed public ledger of transactions that is transparent; secure; self-validating; and cannot be forged. Tampering or tinkering w…,https://slashdot.org/submission/8084827/blockchain
Blockchain,Blockchain technology is revolutionizing the way in which information is stored and shared. It facilitates the creation of a distributed public ledger of transactions that is transparent; secure; self-validating; and cannot be forged. Tampering or tinkering w…,https://blockchain-help.deviantart.com/art/Blockchain-740170195
Blockchain,View on Dribbble,https://dribbble.com/shots/4468604-Blockchain
BlockChain,Work in progress for upcoming project!,https://dribbble.com/shots/4687026-BlockChain
Blockchain,Editorial illustration (ink over Moleskine watercolor album A3 + colors on Procreate app and Photoshop),https://dribbble.com/shots/4615656-Blockchain
Jack Ma: Blockchain เป็นเทรนด์ใหญ่ ที่ไม่อยู่ในภาวะฟองสบู่,Jack Ma ผู้ก่อตั้ง Alibaba ร่วมเวทีเสวนาในงาน World Intelligence Congress ที่เมืองเทียนจิน โดยตอนหนึ่งเขาได้พูดถึงเงินคริปโตและ Blockchain ว่าสถานการณ์ตอนนี้ เทคโนโลยี Blockchain ยังไม่เป็นภาวะฟองสบู่ แต่ถ้าพูดถึง Bitcoin ตอนนี้ถือว่าเป็นฟองสบู่แล้ว เขาอธิบาย…,https://www.blognone.com/node/102401
Blockchain,View on Dribbble,https://dribbble.com/shots/4558845-Blockchain
Insights MINDMAPS: “Blockchain Technology” and “Plastic Pollution”.,Insights MINDMAPS: “Blockchain Technology” and “Plastic Pollution”. Blockchain Technology Plastic Pollution Blockchain Technology Plastic Pollution The post Insights MINDMAPS: “Blockchain Technology” and “Plastic Pollution”. appeared first on INSIGHTS.,http://www.insightsonindia.com/2018/06/06/insights-mindmaps-blockchain-technology-and-plastic-pollution/
Comment on What’s New in SAP Analytics Cloud and SAP Digital Boardroom Release 2018.09 by shalu siva,This article was very useful to me. Blockchain Training in Chennai | BlockChain Course in Chennai | BlockChain Training | BlockChain Certification,https://blogs.sap.com/2018/05/19/whats-new-in-sap-analytics-cloud-and-sap-digital-boardroom-release-2018.09/comment-page-1/#comments
MLG Blockchain Consulting Appoints Wall Street Investment Banker Kyle Fry as CFO,MLG Blockchain Consulting is pleased to announce the addition of Kyle Fry as Chief Financial Officer for the growing global enterprise blockchain consulting and development firm. Kyle is also a Certified Blockchain Expert (Blockchain Council) and is involved …,http://news.sys-con.com/node/4267952
BlockChain Development Company | Blockchain App Factory,The blockchain is undeniably an ingenious invention; a decentralized database hosted by millions of computers simultaneously; and as its data is accessible to anyone on the internet there is no single version that exists for a hacker to corrupt. Blockchain Ap…,https://slashdot.org/submission/7999109/blockchain-development-company--blockchain-app-factory
Free New Tool for Building Blockchain Skills,Blockchain is understood to be an inherently secure technology; but that doesn’t mean every implementation of blockchain is secure. A new tool; Blockchain CTF; can help train software developers; security professionals; and blockchain experts to design and im…,https://www.youbrandinc.com/blockchain/free-new-tool-for-building-blockchain-skills/
MLG Blockchain Consulting Appoints Wall Street Investment Banker Kyle Fry as CFO,MLG Blockchain Consulting is pleased to announce the addition of Kyle Fry as Chief Financial Officer for the growing global enterprise blockchain consulting and development firm. Kyle is also a Certified Blockchain Expert (Blockchain Council) and is involved …,http://businesswire.sys-con.com/node/4267952
Boston’s Historic Beacon Street to be Renamed “Blockchain Street”,Part prank; part revolution; blockchain enthusiasts are renaming Boston’s historic Beacon Street to “Blockchain Street.” The stunt will kick off Boston Blockchain Week; a citywide celebration of the groundbreaking technology known as blockchain. To commemorat…,http://businesswire.sys-con.com/node/4258785
