title, description
xmr-stak,Unified All-in-one Monero miner (no cuda),https://aur.archlinux.org/packages/xmr-stak/
XMR Wallet Send Funds,Hello everyone! Today i want to show dashboard for XMR Wallet. This plaform can help send and receive Monero safely and securely; anywhere and any time. I hope you will enjoy! Cheers! Follow me: https://www.behance.net/antonavilov Thanks,https://dribbble.com/shots/4529513-XMR-Wallet-Send-Funds
XMR-Stak Miner,,https://www.sophos.com/en-us/threat-center/threat-analyses/adware-and-puas/XMR-Stak%20Miner.aspx
Monero [XMR] prices drops by 45% in a month,Facebook Arjun.B is an intern at Ambcrypto who likes to learn and keep himself updated. Monero [XMR] introduces Tari; a counterparty by the tycoons Changelly confirms active Monero [XMR] trading on the platform Coincheck to delist Monero [XMR]; Zcash [ZEC] an…,https://www.youbrandinc.com/crytocurrency/monero-xmr-prices-drops-by-45-in-a-month/
XMR Wallet Dashboard,Hello everyone! Today i want to show dashboard for XMR Wallet. This plaform can help send and receive Monero safely and securely; anywhere and any time. I hope you will enjoy! Cheers! Follow me: https://www.behance.net/antonavilov Thanks,https://dribbble.com/shots/4479918-XMR-Wallet-Dashboard
xmr-stak-opencl-amd,Unified All-in-one Monero miner (AMD),https://aur.archlinux.org/packages/xmr-stak-opencl-amd/
Monero Technical Analysis – Looking at support Levels – 06/06/18,Monero’s XMR gained 4.73% on Tuesday; partially reversing Monday’s 5.5% slide; to end the day at $167.23. It was a particularly volatile day for Monero’s XMR and the broader cryptomarket; with Monero’s XMR sliding to an intraday low $156.4 in the early hours;…,https://www.youbrandinc.com/crytocurrency/monero-technical-analysis-looking-at-support-levels-06-06-18/
Ripple [XRP]; Litecoin [LTC]; Monero [XMR] – From low to high? – Sentiment Analysis – April 2,Facebook Joined recently at AMBCrypto as an intern. Passionate; fun loving literature student who has an eye for the market in the world of cryptocurrencies. Monero [XMR] responds to ‘An empirical analysis of traceability in the Monero blockchain’ Monero [XMR…,https://www.youbrandinc.com/crytocurrency/ripple-xrp-litecoin-ltc-monero-xmr-from-low-to-high-sentiment-analysis-april-2/
Monero Classic (XMC) outdoing Monero XMR,After a series of complaints against Monero (XMR) due to the recent botnets that are being used by miners to mine Monero and the attempt by Monero developers to change the proof of works; Monero community could no longer bear the pressure. At last the cryptoc…,https://www.youbrandinc.com/crytocurrency/monero-classic-xmc-outdoing-monero-xmr/
Crypto update: Bitcoin (BTC); Ripple (XRP); and Monero (XMR) plunge lower,The Bitcoin (BTC); Ripple (XRP); and Monero (XMR) prices have plunged lower overnight...,https://www.fool.com.au/2018/03/13/crypto-update-bitcoin-btc-ripple-xrp-and-monero-xmr-plunge-lower/
Bitmain’s new $12K cryptocurrency miner might be useless by the time it ships,Bitcoin mining titan Bitmain has launched a new ultra-powerful cryptocurrency miner specifically designed for the CryptoNight hashing algorithm which powers privacy-oriented coins like Monero (XMR) and Bytecoin (BCN). But there is one massive problem: the dev…,https://www.youbrandinc.com/crytocurrency/bitmains-new-12k-cryptocurrency-miner-might-be-useless-by-the-time-it-ships/
Monero Price Lead the Selloff; Cardano and Bitcoin Cash Fumbled,Monero Price (XMR) tumbled at a double-digit rate today; extending its declining trend for a third day straight after hitting a two-month high earlier in the week. The broader selloff in cryptocurrencies impacted XMR price; the fresh wave of downside volatili…,https://www.youbrandinc.com/crytocurrency/monero-price-lead-the-selloff-cardano-and-bitcoin-cash-fumbled/
XMR Cryptonight V7 And Sumokoin Hardfork,,http://feedproxy.google.com/~r/avaxhome/bojL/~3/PDxB2Cwx7Qw/B07CMRNVL1.html
Сircle добавляет Monero в свое инвестиционное приложение,Блокчейн стартап Circle объявил о добавлении криптовалюты Monero (XMR) в свое инвестиционное приложение.,https://news.finance.ua/ru/news/-/425964/sircle-dobavlyaet-monero-v-svoe-investitsionnoe-prilozhenie
Monero [XMR]’s still under the bear’s grip – diminishes by 4.52%,Facebook Anirudh VK is a full-time journalist at AMBCrypto. He has a passion for writing and interest towards the future of blockchain technology and cryptocurrencies. He does not own any cryptocurrencies currently. Monero [XMR]; NEM [XEM]; NEO; Lisk [LSK]; V…,https://www.youbrandinc.com/crytocurrency/monero-xmrs-still-under-the-bears-grip-diminishes-by-4-52/
Monero Mining: An Introduction to Entering the Privacy Coin Mining World,Monero (XMR) continues to gain attention amongst the cryptocurrency community as a solution for transaction privacy. Founded in 2014; the project has quickly ascended as the leader of privacy coins. If you’re interested in mining Monero; here are the details …,https://www.youbrandinc.com/crytocurrency/monero-mining-an-introduction-to-entering-the-privacy-coin-mining-world/
Ripple [XRP]’s CEO talks about advanced innovative payment experiences,Facebook Sthuthie Murthy is a full-time reporter at AMBCrypto. She has been researching and writing about the Blockchain technology for a year now. Her passion for blockchain has led her to be a part of AMBCrypto’s news reporting team. She does not hold value…,https://www.youbrandinc.com/crytocurrency/ripple-xrps-ceo-talks-about-advanced-innovative-payment-experiences/
Censorship Resistant Video Platform Ciph Now Accepting Monero,Ciph; the premium social video platform built for privacy; security and censorship resistance; is now accepting payments in Monero (XMR).,https://hackernoon.com/censorship-resistant-video-platform-ciph-now-accepting-monero-91d0d6088e7
Monero [XMR]’s uphill struggle against Dash continues,Facebook Rajath Kumar is an intern at AMBCrypto. He became aware of the crypto-world through gaming and has been a part of it for two years now. Rajath does not hold any value in any cryptocurrencies or its projects. Monero [XMR] drops down to 13th position M…,https://www.youbrandinc.com/crytocurrency/monero-xmrs-uphill-struggle-against-dash-continues/
Пользователей Mac заражает майнер криптовалюты Monero,Специалисты Malwarebytes проанализировали малварь mshelper; заражающих пользователей macOS майнером криптовалюты Monero(XMR).,https://xakep.ru/2018/05/25/mshelper-for-mac/
