title, description
Stellar (XLM) And Verge (XVG) Join Bitfinex,Today; we report the introduction of 2 new token listings; Verge (XLM); and Verge (XVG) to the Bitfinex trading platform. Bitfinex; one of the largest exchanges in the world; will now list Stellar (XLM) and Verge (XVG) — representing a […] The post Stellar (X…,https://www.valuewalk.com/2018/05/stellar-xlm-verge-xvg-bitfinex/
Crypto update: Bitcoin (BTC); Litecoin (LTC); and Stellar Lumens (XLM) climb higher,The Bitcoin (BTC); Litecoin (LTC); and Stellar Lumens (XLM) prices have climbed higher on Tuesday morning...,https://www.fool.com.au/2018/04/03/crypto-update-bitcoin-btc-litecoin-ltc-and-stellar-lumens-xlm-climb-higher/
Crypto update: Bitcoin (BTC); Ripple (XRP); and Litecoin (LTC) plunge lower,The Bitcoin (BTC); Ripple (XRP); Litecoin (LTC); and Stellar Lumens (XLM) prices have plunged lower...,https://www.fool.com.au/2018/04/05/crypto-update-bitcoin-btc-ripple-xrp-and-litecoin-ltc-plunge-lower/
Stellar (XLM) Faces No Real Competition While Ethereum (ETH); EOS (EOS) And Cardano (ADA) Fight For The Throne,Stellar (XLM) is a unique cryptocurrency as it has no ‘real competition’. Some might consider Ripple (XRP) to be its rival; but that is simply not true. Ripple is a cross border payments platform that empowers financial institutions whereas Stellar (XLM) is a…,https://www.youbrandinc.com/crytocurrency/stellar-xlm-faces-no-real-competition-while-ethereum-eth-eos-eos-and-cardano-ada-fight-for-the-throne/
Bitcoin [BTC]; Ripple [XRP]; Stellar Lumens [XLM] among the 50 coins listed on CoinbitGlobal Exchange,Facebook Aman Swami is an Economics major from Christ University. He is very passionate about cryptocurrency and understanding of financial markets. Decision taken to fork Stellar Lumens [XLM] in an attempt to scale Kin Stellar Lumens [XLM] based smart wallet…,https://www.youbrandinc.com/crytocurrency/bitcoin-btc-ripple-xrp-stellar-lumens-xlm-among-the-50-coins-listed-on-coinbitglobal-exchange/
Why Ripple (XRP); Stellar (XLM); Verge (XVG) and Tron (TRX) Are The Future,Stellar Lumens (XLM) and Litecoin (LTC) Price Set to be Trading at Higher Ground TRON [TRX] Recent Events and Developments Impacting its Future TRON [TRX] Being Mixed – Price Analysis XRP is currently valued at $0.65; XLM is currently trading at $0.25; XVG is…,https://www.youbrandinc.com/crytocurrency/why-ripple-xrp-stellar-xlm-verge-xvg-and-tron-trx-are-the-future/
Cardano (ADA); Stellar (XLM); Ripple (XRP) and the rest of the altcoins are on fire,Cardano (ADA); Stellar (XLM); Ripple (XRP) and the rest of the altcoins are on fire this week. Here's what you need to know...,https://www.fool.com.au/2018/03/21/cardano-ada-stellar-xlm-ripple-xrp-and-the-rest-of-the-altcoins-are-on-fire/
Bitcoin (BTC) survives the death cross and surges higher,The bitcoin (BTC) price has survived the death cross and surged higher. As has the Stellar Lumens (XLM) price...,https://www.fool.com.au/2018/04/03/bitcoin-btc-survives-the-death-cross-and-surges-higher/
Stellar (XLM) - quand petit Poucet deviendra géant,Au cours des derniers mois; les mauvaises nouvelles se sont multipliées pour les tradeurs de cryptomonnaies. Avec les suspensions venues de Chine et de Corée du Sud; les rumeurs de réglementations strictes venant de France; des Etats-Unis et de nombreux autre…,https://www.agoravox.fr/actualites/economie/article/stellar-xlm-quand-petit-poucet-202576
I Just Wrote a Stellar Smart Contract Pt. 2: Let’s Dig a Little Deeper,A little over a month ago; I wrote part 1 of this multi-part series; detailing my journey into the world of Stellar Smart Contracts…,https://hackernoon.com/i-just-wrote-a-stellar-smart-contract-pt-2-lets-dive-a-little-deeper-a8dae19b9d0a
Crypto update: Bitcoin (BTC); Ethereum (ETH); Ripple (XRP); and Stellar (XLM) slide lower,Bitcoin (BTC); Ethereum (ETH); Ripple (XRP); and Stellar (XLM) are sliding lower on Tuesday morning. Here's what you need to know...,https://www.fool.com.au/2018/05/08/crypto-update-bitcoin-btc-ethereum-eth-ripple-xrp-and-stellar-xlm-slide-lower/
Crypto update: Bitcoin (BTC) and Ethereum (ETH) slide lower; Litecoin (LTC) jumps,The Bitcoin (BTC) price and Ethereum (ETH) price have dropped lower; but Litecoin (LTC); EOS (EOS); and Stellar (XLM) have jumped higher...,https://www.fool.com.au/2018/04/18/crypto-update-bitcoin-btc-and-ethereum-eth-slide-lower-litecoin-ltc-jumps/
Bitfinex Introduces Fiat Trading Pairs for Stellar (XLM) and Verge (XVG),Major crypto exchange Bitfinex has listed two new currencies as of today: Stellar (XLM) and Verge (XVG). Both currencies are in the top 30 coins with Stellar in 8th place boasting a market cap of $8 billion while trading at $0.431 and Verge in 23rd place valu…,https://www.ccn.com/bitfinex-introduces-trading-of-stellar-and-verge/
Verge (XVG); Stellar (XLM); and EOS: Here’s What’s Happening,Verge is currently selling for $0.094467; which puts the coin up 16.49% in the past 24 hours. There are many speculations going on about Verge. Supposedly; a mystery partner of the company is going to be revealed to us on April 16th. This would explain a lot …,https://www.youbrandinc.com/crytocurrency/verge-xvg-stellar-xlm-and-eos-heres-whats-happening/
Bitfinex Announce Support for Stellar (XLM) and Verge (XVG),Bitfinex; one of the world’s largest cryptocurrency exchanges; has added Stellar Lumens and Verge to its list of supported currencies. This follows recent news of new fiat pairs including British pounds GBP and Japanese Yen JPY. Bitfinex Adds Two Coins and Mo…,https://www.newsbtc.com/2018/05/01/bitfinex-announce-support-for-stellar-xlm-and-verge-xvg/
Stellar [XLM] with its Consecutive Success Could Dethrone Leading Cryptocurrencies,Walmart And Moneygram Partnership Could Pump Ripple (XRP) VERGE [XVG] Price Top Performing as Qt Wallet set to be Released for Win and Mac OS In the last months; Stellar Lumens [XLM] has been taking center stage almost in a daily basis with its initiatives be…,https://www.youbrandinc.com/crytocurrency/stellar-xlm-with-its-consecutive-success-could-dethrone-leading-cryptocurrencies/
Bitfinex Announce Support for Stellar (XLM) and Verge (XVG),-Bitcoin news; price; information & analysis Bitfinex; one of the world’s largest cryptocurrency exchanges; has added Stellar Lumens and Verge to its list of supported currencies. This follows recent news of new fiat pairs including British pounds GBP and Jap…,https://www.youbrandinc.com/crytocurrency/bitfinex-announce-support-for-stellar-xlm-and-verge-xvg/
Asian Cryptocurrency Trading Roundup: Top Altcoin is Stellar Lumens,FOMO Moments The selloff that started yesterday has fortunately abated and markets have not tumbled back levels seen at the beginning of the month. Total crypto capitalization has returned back over $400 billion; led by Bitcoin which is trading 3.6% higher to…,https://www.newsbtc.com/2018/04/27/asian-cryptocurrency-trading-roundup-top-altcoin-is-stellar-lumens-2/
Ripple(XRP); Litecoin(LTC); & Stellar(XLM) – Future Cashless Society?,Yesterday; The European Central Bank released a statement named; “Bitcoin not the answer to a cashless society.” They expressed that next week 20 policymakers would sit down and take a look at Bitcoin and the other cryptocurrencies as they recognize that non-…,https://www.youbrandinc.com/crytocurrency/ripplexrp-litecoinltc-stellarxlm-future-cashless-society/
NEM(XEM); Cardano(ADA); Stellar(XLM); & NEO Take a Nosedive,The cryptocurrency market has just dipped below the $200 billion mark; for the first time in six weeks. This market correction has Google (NASDAQ:GOOGL) to blame because mid-week; the company announced that they would be banning cryptocurrency ICO ads on thei…,https://www.youbrandinc.com/crytocurrency/nemxem-cardanoada-stellarxlm-neo-take-a-nosedive/
